{"schema_version":1,"release":"v0.0.1","source_commit":"1111111111111111111111111111111111111111","source_tree":"2222222222222222222222222222222222222222","issued_unix":1704067200,"expires_unix":1735689600,"compatibility":{"bundle":"asb-tui-v1-linux-x86_64","architecture":"x86_64","asb_version":"0.1.0","protocol_version":1,"coordinator_version":"v0.3.5","coordinator_commit":"510817b93feb80dde13e5a6c61d657954fae2346","quality_version":"v0.23.0","quality_commit":"8a9f056b7fc7926b9465a0f7a09225d4da1c572a"},"components":[{"name":"asb-tui","version":"v0.0.1","commit":"1111111111111111111111111111111111111111","tree":"2222222222222222222222222222222222222222","artifact_sha256":"ec278a6ae7c67eaf28b7dd7f7ad5640225ca05d1fa8046dba541e9bc059598e9"},{"name":"agent-workflow-coordinator","version":"v0.3.5","commit":"510817b93feb80dde13e5a6c61d657954fae2346","tree":"41d08ed42333cb47b07c2c401a9167b56c7cfb81","artifact_sha256":"a51e58ed71dd93979acc55560fc8208db7131d8e6d0a6b7b805fa383fef25b34"},{"name":"agent-workflow-quality","version":"v0.23.0","commit":"8a9f056b7fc7926b9465a0f7a09225d4da1c572a","tree":"ca77db478f0737142690d37683d826710cd953b0","artifact_sha256":"9d480cabe955a5faf88f6f1c8dfd2bfe63045445173c86f93d200a00c97fff89"}],"artifacts":[{"name":"asb-tui","kind":"executable","url":"https://github.com/martin-beck/asb-tui/releases/download/v0.0.1/asb-tui","size":329,"sha256":"ec278a6ae7c67eaf28b7dd7f7ad5640225ca05d1fa8046dba541e9bc059598e9"},{"name":"source","kind":"source","url":"https://github.com/martin-beck/asb-tui/releases/download/v0.0.1/source.tar.gz","size":1,"sha256":"aaaaaaaaaaaaaaaaaaaaaaaaaaaaaaaaaaaaaaaaaaaaaaaaaaaaaaaaaaaaaaaa"},{"name":"licenses","kind":"license_report","url":"https://github.com/martin-beck/asb-tui/releases/download/v0.0.1/licenses.json","size":1,"sha256":"bbbbbbbbbbbbbbbbbbbbbbbbbbbbbbbbbbbbbbbbbbbbbbbbbbbbbbbbbbbbbbbb"},{"name":"sbom","kind":"sbom","url":"https://github.com/martin-beck/asb-tui/releases/download/v0.0.1/sbom.spdx.json","size":1,"sha256":"cccccccccccccccccccccccccccccccccccccccccccccccccccccccccccccccc"},{"name":"provenance","kind":"provenance","url":"https://github.com/martin-beck/asb-tui/releases/download/v0.0.1/provenance.json","size":1,"sha256":"dddddddddddddddddddddddddddddddddddddddddddddddddddddddddddddddd"}]}
